{"finding_id":"EQA-FND-EXAMPLE-001","family":"Technical Editing","skill_id":"TE","status":"finding","location":"p12 heading 2","observed":"Heading level differs across records.","expected":"Approved heading level.","authority":"TE-RULE-1","evidence":["TE-E1","chapter.docx:p12"],"severity":"moderate","confidence":"high","intervention":"escalate","dependencies":[],"owner":"TE owner","state_history":[{"state":"signal","at":"2026-08-14T00:00:00Z","actor":"TE"},{"state":"finding","at":"2026-08-14T00:01:00Z","actor":"EQA","reason":"direct comparison"}],"release_effect":"track"}
